Left context;Center;Punct;Subject;Number;Gender;Animacy;Verb;Verb_of_speech;Ger;Verb_time;Object;Protiv1;Protiv2;Right context;Full context;;;;;;;;;;;;;Title;Author;Birthday;Header;Created;Sphere;Type;Topic;Publication;Publ_year;Medium;Ambiguity
 ещё нечто такое, за что ; чуть ;  ;сам;Sg;M;1;сесть;0;0;Past;0;0;0;не сел сам, спешно переехал ; Потом совершил ещё нечто такое, за что чуть не сел сам, спешно переехал в Москву, а тут началась война, и киевским органам стало не до Турганова.  [Владимир Войнович. Иванькиада, или рассказ о вселении писателя Войновича в новую квартиру (1976)] [омонимия снята];;;;;;;;;;;;;Владимир Войнович. Иванькиада, или рассказ о вселении писателя Войновича в новую квартиру (1976) ;Владимир Войнович ;1932 ;Иванькиада, или рассказ о вселении писателя Войновича в новую квартиру ;1976 ;художественная ;повесть ; ;Владимир Войнович. Замысел. ;2000 ;книга ;омонимия снята
 вернулся из леса после похорон, ; чуть ;  ;Глебов;Sg;M;1;умереть;0;0;Past;0;0;0;не умер от воспаления лёгких ; Глебов вернулся из леса после похорон, чуть не умер от воспаления лёгких, его выходила баба Нила.  [Юрий Трифонов. Дом на набережной (1976)] [омонимия снята];;;;;;;;;;;;;Юрий Трифонов. Дом на набережной (1976) ;Юрий Трифонов ;1925 ;Дом на набережной ;1976 ;художественная ;повесть ; ;СС в 4 тт., т.2 ;1986 ;книга ;омонимия снята
   Васюта ; чуть ;;Васюта;Sg;F;1;попасться;0;0;Past;2;0;0;не попалась на хитрость, чуть ;  Васюта чуть не попалась на хитрость, чуть не вскрикнула было, что она помнит все три слова радостных.  [Марк Сергеев. Волшебная галоша, или Необыкновенные приключения Вадима Смирнова, его лучшего друга Паши Кашкина и 33 невидимок из 117-й школы (1971)] [омонимия снята];;;;;;;;;;;;;Марк Сергеев. Волшебная галоша, или Необыкновенные приключения Вадима Смирнова, его лучшего друга Паши Кашкина и 33 невидимок из 117-й школы (1971) ;Марк Сергеев ;1926 ;Волшебная галоша, или Необыкновенные приключения Вадима Смирнова, его лучшего друга Паши Кашкина и 33 невидимок из 117-й школы ;1971 ;художественная ;повесть ; ;Сергеев Марк. Волшебная галоша ;1971 ;книга ;омонимия снята
 рассказала, как она и Куник ; чуть ;  ;она и Куник;Pl;Pl;1;сойти с ума;0;0;Past;3;0;0;не сошли с ума.  ; Однажды рассказала, как она и Куник чуть не сошли с ума.  [Юрий Трифонов. Дом на набережной (1976)] [омонимия снята];;;;;;;;;;;;;Юрий Трифонов. Дом на набережной (1976) ;Юрий Трифонов ;1925 ;Дом на набережной ;1976 ;художественная ;повесть ; ;СС в 4 тт., т.2 ;1986 ;книга ;омонимия снята
   ? Я? стахановец вечный! ? ; чуть ;  ;старик;Sg;M;1;закричать;1;0;Past;1;0;0;не закричал старик.  ;  ? Я? стахановец вечный! ? чуть не закричал старик.  [Василий Шукшин. Калина красная (1973)] [омонимия снята];;;;;;;;;;;;;Василий Шукшин. Калина красная (1973) ;Василий Шукшин ;1929 ;Калина красная ;1973 ;художественная ;киноповесть ; ;Василий Шукшин. Собрание сочинений (в 3 томах), т3 ;2003 ;книга ;омонимия снята
 У меня справка об освобождении! ? ; чуть ;  ;Егор;Sg;M;1;заорать;1;0;Past;1;0;0;не заорал ему в лицо ;  ? У меня справка об освобождении! ? чуть не заорал ему в лицо Егор.  [Василий Шукшин. Калина красная (1973)] [омонимия снята];;;;;;;;;;;;;Василий Шукшин. Калина красная (1973) ;Василий Шукшин ;1929 ;Калина красная ;1973 ;художественная ;киноповесть ; ;Василий Шукшин. Собрание сочинений (в 3 томах), т3 ;2003 ;книга ;омонимия снята
 Да они же изобьют его! ? ; чуть ;  ;Люба;Sg;F;1;плакать;1;0;Past;1;0;0;не плакала Люба.  ;  ? Да они же изобьют его! ? чуть не плакала Люба.  [Василий Шукшин. Калина красная (1973)] [омонимия снята];;;;;;;;;;;;;Василий Шукшин. Калина красная (1973) ;Василий Шукшин ;1929 ;Калина красная ;1973 ;художественная ;киноповесть ; ;Василий Шукшин. Собрание сочинений (в 3 томах), т3 ;2003 ;книга ;омонимия снята
